{
  "$id": "https://pcs.sentinelops.ci/schemas/VerifierMutationManifest.v1.schema.json",
  "$schema": "https://json-schema.org/draft/2020-12/schema",
  "additionalProperties": false,
  "description": "Typed immutable-profile mutation record.",
  "properties": {
    "artifact_type": {
      "const": "VerifierMutationManifest.v1"
    },
    "base_profile_ref": {
      "$ref": "verifier_assurance.defs.json#/$defs/profile_ref"
    },
    "canonicalization_version": {
      "$ref": "common.defs.json#/$defs/canonicalization_version"
    },
    "created_at": {
      "$ref": "common.defs.json#/$defs/iso8601_datetime"
    },
    "expected_effect": {
      "minLength": 1,
      "type": "string"
    },
    "integrity": {
      "$ref": "verifier_assurance.defs.json#/$defs/nested_integrity"
    },
    "mutated_profile_ref": {
      "$ref": "verifier_assurance.defs.json#/$defs/profile_ref"
    },
    "mutation_class": {
      "$ref": "verifier_assurance.defs.json#/$defs/mutation_class"
    },
    "mutation_id": {
      "maxLength": 256,
      "minLength": 1,
      "type": "string"
    },
    "parameters": {
      "type": "object"
    },
    "producer": {
      "maxLength": 256,
      "minLength": 1,
      "type": "string"
    },
    "producer_version": {
      "maxLength": 128,
      "minLength": 1,
      "type": "string"
    },
    "production_prohibition": {
      "const": true
    },
    "rationale": {
      "minLength": 1,
      "type": "string"
    },
    "schema_version": {
      "$ref": "common.defs.json#/$defs/schema_version_v1"
    },
    "signature_or_digest": {
      "$ref": "verifier_assurance.defs.json#/$defs/forbid_signature_or_digest"
    },
    "source_commit": {
      "$ref": "verifier_assurance.defs.json#/$defs/git_commit_sha40"
    },
    "source_repo": {
      "format": "uri",
      "type": "string"
    },
    "supported_by_adapter": {
      "type": "boolean"
    }
  },
  "required": [
    "schema_version",
    "artifact_type",
    "canonicalization_version",
    "mutation_id",
    "base_profile_ref",
    "mutated_profile_ref",
    "mutation_class",
    "expected_effect",
    "production_prohibition",
    "producer",
    "producer_version",
    "created_at",
    "integrity"
  ],
  "title": "VerifierMutationManifest.v1",
  "type": "object"
}
